{
  "$schema": "../.schemas/src/App.svelte.schema.json",
  "Connect with us": "تواصل معنا",
  "Documentation": "التوثيق",
  "Edit <code>src/App.svelte</code> and save to test <code>HMR</code>": "عدل <code>src/App.svelte</code> واحفظه لاختبار <code>HMR</code>",
  "Explore Vite": "استكشف فيت",
  "Get started": "البدء",
  "Join the Vite community": "انضم إلى مجتمع فيت",
  "Learn more": "تعلم المزيد",
  "Svelte logo": "شعار سفتلي",
  "Vite logo": "شعار فيت",
  "Your questions, answered": "تمت الإجابة على أسئلتك"
}
